topic_id	tweet_id	tweet_url	tweet_text	claim
covid-19	1.23748129383693E+018	https://twitter.com/user/status/1237481293836926979	#coronavirus Italy update: Codogno, the first town to face lockdown about three weeks ago, just reported that the number of new infected patients has reached 0. The lockdown works: the draconian measures imposed on the area made this happen in just a few weeks.	1
covid-19	1.23711945073168E+018	https://twitter.com/user/status/1237119450731683846	Personally, I feel like we should replicate this in England. Just scrap the league and rank the teams in alphabetical order, then we can return to normality next season. https://t.co/SYbGsrNAUu	0
covid-19	1.23671252350143E+018	https://twitter.com/user/status/1236712523501428736	Alhamdulillah ✌ #Modi's visit to Dhaka postponed due to countrywide massive protests. They said this discission is for #CoronaVirus but It's absolutely face saving reason. So how's the massive protests modiji? - Fantastic? 😉 https://t.co/5vbLEatvL7	1
covid-19	1.23738735775975E+018	https://twitter.com/user/status/1237387357759754240	"/translation/ ""Doc, what to do to avoid Corona?"" ""Doc, what can we do, we're living in squatters area, we don't have water sometimes, the house is cramped, and also, we can't have a proper meal to eat."" This is the reality. #nCoV19 is still a class issue. https://t.co/mr0ioEumc7"	1
covid-19	1.23688085590311E+018	https://twitter.com/user/status/1236880855903109121	Seattle copying Korean drive-thru-testing. “Seattle has turned a hospital garage lot into a drive-through clinic that can test a person every 5 min— results within a day or so. But the idea also about safety— doesn’t put hospital HCWs at risk.” #COVID19 https://t.co/CS3IoDcVx6	1
covid-19	1.23728141070186E+018	https://twitter.com/user/status/1237281410701864967	make it one million and Im in https://t.co/9G93tALIDl	0
covid-19	1.2374478389483E+018	https://twitter.com/user/status/1237447838948302849	Thousands have died #Coronavirus. The stock market has collapsed. Recession may be imminent. And the so-called President spent the weekend at a Florida golf resort. Pathetic. https://t.co/grWXjpR849	1
covid-19	1.23685073016356E+018	https://twitter.com/user/status/1236850730163560448	#CoronavirusOutbreak #DontPanicBeCautious It is always good to practice good hygiene!! At Omid Dental here in South Gate, we are prepared to protect our patients!! https://t.co/o9ymrc77i1	0
covid-19	1.23729516239458E+018	https://twitter.com/user/status/1237295162394583040	Roughly 4000 people have died so far from #Coronavirus Global markets in chaos. During 2014/15 Ebola outbreak, roughly 30,000 people died in Liberia, Sierra Leone and Guinea. Markets didn't even notice. The heartbreaking reality of being on the margins of the global economy.	1
covid-19	1.23719213775145E+018	https://twitter.com/user/status/1237192137751449600	Hanbin worked with the same business group that helped him to get masks for COVID-19 to volunteer at a children's center last year, where they held Christmas parties and he dressed up as Santa.. (im not crying)	1
covid-19	1.23743781430177E+018	https://twitter.com/user/status/1237437814301773825	If it turns out we are immune I’m going straight to Wuhan to roll on the floor https://t.co/hxGzivv80i	0
covid-19	1.23757073778895E+018	https://twitter.com/user/status/1237570737788948481	When the Seattle researchers found #coronavirus in one of the samples, the message from the federal government was: “Stop testing.” https://t.co/MKcOAnS1Hl	1
covid-19	1.23701473539829E+018	https://twitter.com/user/status/1237014735398285312	Stock market in bad shape, Corona virus causing huge unrest in America. Just curious if Trump supporters ok with President having a political fundraiser today?	1
covid-19	1.23713205583994E+018	https://twitter.com/user/status/1237132055839936514	President Trump, hellbent on re-election, is focused on massaging numbers and silencing bearers of bad news. That’s what autocrats do. And it’s endangering lives. Want proof? Look at all the folks wheeling @s at me about how #Covid2019 is just a flu. https://t.co/mEOIRHQuRO	1
covid-19	1.23715955694341E+018	https://twitter.com/user/status/1237159556943413248	Trump’s payroll-tax cut will NOT help hourly wage earners, who would pay NO tax if businesses close, and they can’t work. What’s needed: ▶️Free #coronavirus tests ▶️Free healthcare for #COVID19 ▶️Paid sick leave In a #pandemic, we are only as healthy as the LEAST healthy.	0
covid-19	1.23722870681865E+018	https://twitter.com/user/status/1237228706818654208	This is the #coronavirus content we NEED 😂😂🇺🇸 https://t.co/GwjzUkb16U	0
covid-19	1.23730366692039E+018	https://twitter.com/user/status/1237303666920394753	COVID-19 cases in the Philippines jumped from 24 to 35 in less than 12 hours. This is seriously ALARMING. Stay safe everyone! https://t.co/bNBFAun6Ju	1
covid-19	1.23749546939748E+018	https://twitter.com/user/status/1237495469397475331	The fact that some parents don't want school to close because of #COVID19 because they don't have childcare and some can't afford to replace the school meal their child will miss is all you need to know about America.	0
covid-19	1.23725878997319E+018	https://twitter.com/user/status/1237258789973188608	🇮🇹 Never seen anything like it. 🏥 In Italy the @DPCgov shared all latest #COVID19 data on @github: • National trend • JSON data • Provinces data • Regions data • Summary cards • Areas There are already PRs for adding APIs &amp; English translations. https://t.co/35Q4SeyAzX https://t.co/xtte53dCsk	1
covid-19	1.23687165093668E+018	https://twitter.com/user/status/1236871650936680449	#Seventeen @pledis_17 HOSHI secretly (without informing Pledis) donated 50M through Hope Bridge Association of the National Disaster Relief. The donation will be used to purchase supplies for the underprivileged affected by COVID-19 and to support medical staffs &amp; volunteers https://t.co/YD9HV7pfFt	1
covid-19	1.23670856747183E+018	https://twitter.com/user/status/1236708567471833090	corona come take me i hate it here	0
covid-19	1.23752224911817E+018	https://twitter.com/user/status/1237522249118171136	That girl was tapping the railing like she was applying a light coat of FENTY Trophy Wife. She looks like she’s never washed a plate in her life. Where’s the vim?? https://t.co/8XULpwjY19	0
covid-19	1.2373656104866E+018	https://twitter.com/user/status/1237365610486599681	Been hearing a lot about ‘the media’ causing #coronavirus hysteria among people. Italy didn’t shut down because of ‘the media’. The Dow isn’t volatile because of ‘the media’. Making people distrust facts and information during a health crisis is dangerous. The end.	1
covid-19	1.23679386312735E+018	https://twitter.com/user/status/1236793863127347200	All of us in January when we learned about corona virus... https://t.co/E9oJ7VBRsB	0
covid-19	1.23730793623533E+018	https://twitter.com/user/status/1237307936235327489	Hey @VP. I'm one of the 'Australian experts' that wrote the list of #COVID19 prevention tips you’re holding. They're meant to be IN ADDITION to: ✅ Access to free testing &amp; health care ✅ Widespread #COVID19 testing &amp; lab-based surveillance ✅ Paid leave arrangements https://t.co/CKMCndRJfA	0
covid-19	3.32105177307947E+017	https://twitter.com/user/status/332105177307947008	@MaxAub1 What is this Corona virus?	0
covid-19	1.23698067567434E+018	https://twitter.com/user/status/1236980675674341376	Trump is running a governmental shell game, a rigged round of three-card monte. He’s set up his folding table on America’s street corner, continues to steal our money, siphoning it into Mar-a-lago and otherwise leaving ailing Americans to fend for themselves. https://t.co/PnJMh4416i	1
covid-19	1.23663615515355E+018	https://twitter.com/user/status/1236636155153547265	Marikina is and will always be the superior city in Metro Manila https://t.co/NxmLtxGPhm	0
covid-19	1.23691462281447E+018	https://twitter.com/user/status/1236914622814466048	Seems like this virus attacks people with no melanin. Haven't seen a black person who caught the virus. I guess the ancestors are finally fighting back. #CoronavirusOutbreak	1
covid-19	1.23741579574069E+018	https://twitter.com/user/status/1237415795740692480	#Coronavirus All of us need to be careful but there is no need to panic. On the other hand, let's not be complacent either. Accept this challenging situation &amp; see how you can use it constructively. Perhaps, Nature wants everybody to slow down a little from the rush they are in.	0
covid-19	1.23683478048789E+018	https://twitter.com/user/status/1236834780487888897	[NEWS] Naver #BAEKHYUN EXO Baekhyun donates 50 million won to prevent the spread of Corona 19 @weareoneEXO #EXO #엑소 @B_hundred_Hyun Please click the link below for more details 🔗https://t.co/c9diM6XfXj https://t.co/X903MJEk1v	1
covid-19	1.23757343130812E+018	https://twitter.com/user/status/1237573431308120064	Influenza B has killed 136 US children this year. COVID-19 has killed ZERO children this year. ZERO schools have been closed to stop the spread of Infuenza B - a known child killer. Schools everywhere are being closed to stop COVID-19 - a virus which does not kill children.	1
covid-19	1.23754311359111E+018	https://twitter.com/user/status/1237543113591107585	A friend got suddenly sick after flying, with all the #coronavirus symptoms. He called the hotline in NYC and was told in order to even *find out where to get tested,* he has to have ALL of these: 1) cough too uncontrollable to speak 2) difficulty breathing and 3) fever &gt; 102	1
covid-19	1.23682981697813E+018	https://twitter.com/user/status/1236829816978132993	@DrPaulGosar It’s called Covid-19 not wuhan virus	1
covid-19	1.23745338117582E+018	https://twitter.com/user/status/1237453381175820289	Gov. Polis declared a state of emergency in CO and will make sure service industry folks get paid sick leave, is demanding out of pocket testing costs be waived and is opening up a drive-up testing facility. This is how it's done. #CoronavirusOutbreak https://t.co/r5tooDYgl2	1
covid-19	1.23756253912425E+018	https://twitter.com/user/status/1237562539124248578	A frustrated doctor eventually told us that my spouse didn't qualify for #COVID19 testing. Though we had been in Paris last week and spent time in airports and on planes with international travelers...and now my spouse had a fever...we don't meet the testing criteria.	1
covid-19	1.2374059480855E+018	https://twitter.com/user/status/1237405948085501953	"Trump's ex-homeland security adviser is pleading publicly for more urgent govt action, calling covid-19 a ""fire that threatens to burn out of control"" and overwhelm US hospitals in 10 days VP Pence just opened WH meeting w/health insurance companies by praising Trump's response"	1
covid-19	1.2374373809295E+018	https://twitter.com/user/status/1237437380929499138	To all of you panic-buying over #coronavirus, two small requests - please don't - buy something for your local foodbank instead https://t.co/EEeSlyHqgQ	0
covid-19	1.2372013717509E+018	https://twitter.com/user/status/1237201371750895617	After months of screwing up COVID-19 planning, then weeks of laughing and lying about it, conservatives are starting to throw in the towel with a new approach: make up a name to appeal to their supporters xenophobia and racism. And then attack Dems for not using the fake name....	1
covid-19	1.23709470647717E+018	https://twitter.com/user/status/1237094706477174784	Breaking: Congress prepares to shutter Capitol Hill for coronavirus, opens telework center https://t.co/dShkLVPmFO	1
covid-19	1.2410255785279E+018	https://twitter.com/user/status/1241025578527903750	For the average American the best way to tell if you have covid-19 is to cough in a rich person’s face and wait for their test results	0
covid-19	1.24046708095423E+018	https://twitter.com/user/status/1240467080954228737	this is fucking bullshit	0
covid-19	1.24071688916202E+018	https://twitter.com/user/status/1240716889162018816	Can y’all please just follow the government’s instructions so we can knock this COVID-19 out and be done?! I feel like a kindergartner that keeps losing more recess time because one or two kids can’t follow directions.	0
covid-19	1.24106251488609E+018	https://twitter.com/user/status/1241062514886090754	No offense but the corona virus disappearing before April actually sucks	0
covid-19	1.24144701794522E+018	https://twitter.com/user/status/1241447017945223169	This is the face of someone who just spent 9 hours in personal protective equipment moving critically ill Covid19 patients around London. I feel broken - and we are only at the start. I am begging people, please please do social distancing and self isolation #covid19 https://t.co/hs0RQdvsn3	1
covid-19	1.24163732032503E+018	https://twitter.com/user/status/1241637320325029889	Yesterday I knocked on my Tennant's door and told him he can stay in the property rent free for 5 months. He is self employed with 4 kids. I don't need Boris to tell me what is morally correct. Landlords, if you can, do more, do something. #COVID19 #BeNice	1
covid-19	1.24151942062896E+018	https://twitter.com/user/status/1241519420628963330	After COVID-19 is over, I better NEVER hear anyone trash “low end” workers again. Those people at the grocery store, the Dollar General workers, those fast food workers, the Walmart employees, those people you didn't even think deserved to have a wage to survive on?	0
covid-19	1.24213743032245E+018	https://twitter.com/user/status/1242137430322446344	This is Dr. Usama Riaz. He spent past weeks screening and treating patients with Corona Virus in Pakistan. He knew there was no PPE. He persisted anyways. Today he lost his own battle with coronavirus but he gave life and hope to so many more. KNOW HIS NAME 😭❤ https://t.co/flSwhLCPmx	1
covid-19	1.24071703937702E+018	https://twitter.com/user/status/1240717039377022977	fun fact: its tradition for europeans to spread a potentially fatal disease to every other country not fully inhabited by white people &amp; not take accountability for the subsequent devastation &amp; lives lost	1
covid-19	1.2403349797014E+018	https://twitter.com/user/status/1240334979701395458	When this Corona shit passes we have to promise each other that we’re going to tell our kids that we survived a zombie apocalypse in 2020	0
covid-19	1.24116130477104E+018	https://twitter.com/user/status/1241161304771039233	So shortness of breath is a corona symptom right but you know what also gives me shortness of breath? Anxiety. And you know what has been giving me anxiety? Thinking I have corona.	0
covid-19	1.24067657516892E+018	https://twitter.com/user/status/1240676575168921600	So, the last week I have been battling COVID-19 &amp; Pneumonia. Never in my life have I been this ill. “Young people aren’t at risk, they’ll only have mild symptoms” Wrong. I want to open up about the difficulties I’ve gone through these past days, what it was like in the ICU...	1
covid-19	1.24212508788676E+018	https://twitter.com/user/status/1242125087886761987	My mum has a PhD on Corona Virus from WhatsApp University	1
covid-19	1.2407685014527E+018	https://twitter.com/user/status/1240768501452697600	He told wealthy friends. Then cashed out a cool $1.4m in stock. Then voted AGAINST the covid-19 relief bill. He needs to go	1
covid-19	1.24144726750212E+018	https://twitter.com/user/status/1241447267502116864	future grandson: “hey grandpa want a corona?” me: https://t.co/ZJbdz22Lps	0
covid-19	1.24133729560666E+018	https://twitter.com/user/status/1241337295606657033	Korea finished developing the 10 minute Covid-19 diagnostic kit and is now ramping up production. They plan to export 300.000 test-kits per week - https://t.co/DpJCph9RT7	1
covid-19	1.24142904101148E+018	https://twitter.com/user/status/1241429041011478529	tw suicide, COVID-19 Hey, so, um, there's a big elephant in the room right now. COVID isn't the only epidemic happening right now - and it's come at a bad, bad time. Not that there's ever a good time. There's a mental health epidemic happening, and we're gonna start seeing-	1
covid-19	1.24241425940713E+018	https://twitter.com/user/status/1242414259407130624	Celebrities keep trying to sing the virus away like this is a Disney movie or something	0
covid-19	1.2419734049928E+018	https://twitter.com/user/status/1241973404992802818	maybe if i develop feelings for covid-19 it will leave	0
covid-19	1.24105791912853E+018	https://twitter.com/user/status/1241057919128526856	THREAD: I mostly talk about movies on here, but here goes. We are currently pivoting our factory to solely make surgical masks and other medical garments in short supply. We can make 2 million masks a day, and are looking to help in any way possible during this time. #COVID19 https://t.co/dOX7N3e1GJ	1
covid-19	1.24063377396592E+018	https://twitter.com/user/status/1240633773965918210	My mans House would pop 6 Vicodin on Thursday and have that cure by Saturday morning.	0
covid-19	1.24125418397977E+018	https://twitter.com/user/status/1241254183979765761	I did almost everything right. Worked at home. Saw one friend in the last 10 days. Had a beer for an hour outside a pub, either side of a big table. Fresh air, no contact. Washed my hands 3 times. Still caught corona from him. Do not fuck around with this thing.	1
covid-19	1.24146591548667E+018	https://twitter.com/user/status/1241465915486670848	I do not understand how mcdonalds can serve two billion hamburgers every year but when I order five million at the drive thru it overwhelms the system	0
covid-19	1.2410090890916E+018	https://twitter.com/user/status/1241009089091600392	Bro China is out here reading niggas power levels and we cant even get adequate testing 🧐	0
covid-19	1.24146621979182E+018	https://twitter.com/user/status/1241466219791822849	When this corona shit is over please invite me out. I know I be flaky sometimes but my ass is going to come outside I promise lol	0
covid-19	1.24187181259142E+018	https://twitter.com/user/status/1241871812591419392	Y’all miss your ex, I miss life without the corona virus	0
covid-19	1.24169616478267E+018	https://twitter.com/user/status/1241696164782669824	“I stopped him and said, 'Look, this isn't a movie. You are not Will Smith in I Am Legend. Go home.” This is the updated compilation of Italian Mayors losing it at people violating #Covid19 quarantine. Yes, subtitles are accurate. https://t.co/60V4Csuonb	0
covid-19	1.24128787835468E+018	https://twitter.com/user/status/1241287878354677760	Please don't take hydroxychloroquine (Plaquenil) plus Azithromycin for #COVID19 UNLESS your doctor prescribes it. Both drugs affect the QT interval of your heart and can lead to arrhythmias and sudden death, especially if you are taking other meds or have a heart condition.	1
covid-19	1.24033591232998E+018	https://twitter.com/user/status/1240335912329977858	Day 5: We have rediscovered farming	0
covid-19	1.2419020015392E+018	https://twitter.com/user/status/1241902001539203073	This Corona virus will pass by mid April !! Speaking it into existence	1
covid-19	1.24230240076291E+018	https://twitter.com/user/status/1242302400762908685	Thank you everyone for your incredible messages of support and encouragement.♥️ Many of you asked what it was like in the ER right now. I want to share a bit with you. Please RT: A Day in the Life of an ER Doc - A Brief Dispatch from the #COVID19 Frontline:	0
covid-19	1.24247640889651E+018	https://twitter.com/user/status/1242476408896507910	My fellow citizens, THERE IS ABSOLUTELY NO NEED TO PANIC. Essential commodities, medicines etc. would be available. Centre and various state governments will work in close coordination to ensure this. Together, we will fight COVID-19 and create a healthier India. Jai Hind!	1
covid-19	1.24078168881859E+018	https://twitter.com/user/status/1240781688818589697	Dogs when they found out their owners can’t leave because of the corona virus https://t.co/ciwmNz0q36	0
covid-19	1.24152854918339E+018	https://twitter.com/user/status/1241528549183385601	no.. one... cleans like Gaston quarantines like Gaston no one stops spreading COVID-19 like Gaston	1
covid-19	1.24124732957268E+018	https://twitter.com/user/status/1241247329572683776	This is why the beaches haven't closed in Florida, and why they've had minimal COVID-19 prevention. Absolute dysfunction. https://t.co/8x2tcQeg21	1
covid-19	1.24140371503629E+018	https://twitter.com/user/status/1241403715036291072	My new favourite thing is Italian mayors and regional presidents LOSING IT at people violating quarantine. Here's an eng subtitled compilation. “I hear you wanna throw graduation parties. I'm gonna send the police over. With flamethrowers.” #Covid19 #coronavirus https://t.co/NbYuWePIVt	0
covid-19	1.24098759408056E+018	https://twitter.com/user/status/1240987594080559105	COVID-19 Finally, some sensible advice from a Nurse “What I have seen a lot of are recommendations for how to try to avoid getting coronavirus in the first place -- good hand washing, personal hygiene and social distancing -- but what I have NOT seen a lot of is advice for...	0
covid-19	1.24066695495807E+018	https://twitter.com/user/status/1240666954958069768	Corona Virus isn't real, the government just wants everyone inside for two weeks so they can change the batteries in the birds.	1
covid-19	1.24135958478404E+018	https://twitter.com/user/status/1241359584784044033	day 6 of quarantine: my dad gave a talk to the cats about covid-19 😭😭😭😭😭😭😭😭 https://t.co/mLdFXzcE2P	0
covid-19	1.24062072730651E+018	https://twitter.com/user/status/1240620727306510342	This is Generation Z. I want to name that because folks love calling everybody 40 and under Millennials. Millennials are not at Spring Break. Millennials are at home yelling at their Boomer parents who won’t sit still because they have “faith over fear”.	1
covid-19	1.24078069136257E+018	https://twitter.com/user/status/1240780691362570240	“hey guys happy self quarantine. The corona virus is a real thing.” wow I had no idea! thanks Kylie! https://t.co/gfPNwVFH3e	0
covid-19	1.24105497627061E+018	https://twitter.com/user/status/1241054976270614535	The World Health Organization warns young people: “You are not invincible.” COVID-19 could “put you in hospital for weeks, or even kill you. Even if you don’t get sick, the choices you make about where you go could be the difference between life and death for someone else.”	1
covid-19	1.24084700690771E+018	https://twitter.com/user/status/1240847006907711490	This man hospital bill bout to be so much.	1
covid-19	1.24169948446953E+018	https://twitter.com/user/status/1241699484469526531	Video of a hospital in Spain. Watch it. Watch it again with the volume up. Now cancel that brunch. Postpone that coffee meet-up. Rain check that dinner with friends. Sucks doesn’t it? But not as hard as this 👇 #COVIDー19 #coronavirus #StayAtHome https://t.co/LM9BnFQf3E	0
covid-19	1.242087413868E+018	https://twitter.com/user/status/1242087413868003333	When you’re a goalkeeper... and an only child... in self isolation... and trying to keep up with your training... 😂😂came up with this himself! I’m so impressed. #coronavirus #StayHomeStaySafe https://t.co/FFzJ1LE3N1	0
covid-19	1.24078964689382E+018	https://twitter.com/user/status/1240789646893821953	Covid-19 might be big, but I just want to remind y’all that our God is BIGGER.✨	0
covid-19	1.24213176866228E+018	https://twitter.com/user/status/1242131768662282243	CDC just announced that corona can be spread via Instagram story challenges :-/	1
covid-19	1.24122501995226E+018	https://twitter.com/user/status/1241225019952263170	Katie Porter's sister, a doctor, is breaking down how staying in can save lives during the COVID-19 crisis https://t.co/9q7MpbpES8	1
covid-19	1.24080512414391E+018	https://twitter.com/user/status/1240805124143906816	Anybody else just randomly yell “Corona Virus” in Cardi’s voice ?	0
covid-19	1.24174535595751E+018	https://twitter.com/user/status/1241745355957514241	These workers need protection, healthcare, and sick pay—regardless of citizenship status. Their services are ESSENTIAL and there needs to be more aggressive dialogue around this issue. WHAT WOULD LIFE LOOK LIKE WITHOUT THEM? I don’t want to know!	0
covid-19	1.24085241220359E+018	https://twitter.com/user/status/1240852412203589632	me: h- my mom with her phd in corona virus after graduating from whatsapp threads: https://t.co/msWK8DKN2G	0
covid-19	1.24195286640469E+018	https://twitter.com/user/status/1241952866404687872	Check out BTS’ message of hope to overcome #COVID19 by looking after each other! We invite Son Heung-min to continue the message!https://t.co/FYtSkDvwjs #StayConnected #StayStrong_ARMY #힘내세요_아미 #우리의응원을이어주세요 #BTSLoveMyself #ENDviolence	0
covid-19	1.24068312336241E+018	https://twitter.com/user/status/1240683123362406410	White People: COVID-19 Black Folks: the RONA Gay People : Miss Rona 😭☠️	0
covid-19	1.24083124886147E+018	https://twitter.com/user/status/1240831248861474816	corona sis you leaving by may right? https://t.co/vwDdLhmAwz	0
covid-19	1.24071497606025E+018	https://twitter.com/user/status/1240714976060248064	wow...taken this morning....never seen Vegas this empty before tbh #coronavirus https://t.co/9YbvuimUX2	0
covid-19	1.24061823549982E+018	https://twitter.com/user/status/1240618235499819008	There was a nasty flu that went round in December / early Jan. I’m telling you, that was corona. Bare ppl were sick (including me) complaining of what we now know as the symptoms for corona.	1
